{
  "updated_at": "2026-10-26T20:14:33.628Z",
  "mission_phase": "PRE-HARDWARE",
  "overall_status": "SYSTEMS NOMINAL",
  "systems": [
    {
      "id": "power",
      "label": "POWER",
      "status": "dev",
      "value": "CONCEPT",
      "detail": "Ground power models only — flight solar not baselined"
    },
    {
      "id": "comms",
      "label": "COMMS",
      "status": "dev",
      "value": "SPEC",
      "detail": "CubeSat relay is a concept architecture, not selected hardware"
    },
    {
      "id": "balloon",
      "label": "AEROSTAT",
      "status": "dev",
      "value": "PLANNED",
      "detail": "Fluoropolymer envelope trade — no acid chamber coupons yet"
    },
    {
      "id": "avionics",
      "label": "AVIONICS",
      "status": "dev",
      "value": "SPEC",
      "detail": "Rad-tolerant stack not selected; no flight board yet"
    },
    {
      "id": "nav",
      "label": "NAV/AI",
      "status": "dev",
      "value": "SIM",
      "detail": "Algorithms discussed in sim notes only — not flight software"
    },
    {
      "id": "funding",
      "label": "FUNDING",
      "status": "dev",
      "value": "PLANNED",
      "detail": "Crowdfund rails incomplete; $500k is ground-test campaign target"
    }
  ]
}
